{"schemaVersion":1,"kind":"whiteboard-defense","module":{"id":"whiteboard-test/defense","version":"1.0.0","digest":"sha256:ed7d86c6c7df6238aad12515443ded715395d53182a92a90ecdfeea1a5345e08"},"source":{"attemptId":"whiteboard-test-and-judge-isolation-pr67-attempt-19","scope":"FEATURE","baseSha":"10e54a08ddfa0815bb8d4d2ae393f7c0c7ae2602","headSha":"a930cb08704840535fe9edcb45c17d9592035c10","inputFingerprint":"sha256:f3df901b6367627be4cc0ae1e53f04bfaca95897705548a6247b2c620837a3fb"},"outcome":"PASS","summary":"This defense covers the pinned feature-final scope: Whiteboard Test activation, staged isolated agent workflows, digest-bound Whiteboard and Judge artifacts, Desktop/headless parity, provider adapters, packaging, and release implications. The implementation is defensible for the pinned scope, with several explicitly disclosed limitations around semantic validation, provider-side hidden state, same-attempt overwrite protection, cross-process scheduling, and model navigation of large sidecars.","substantive":true,"artifactDeficiencies":[],"validation":{"schemaVersion":1,"validator":"whiteboard-test/deterministic-v1","result":"PASS","checks":["challenge-integrity","evidence-resolution","native-progressive-reveal","visual-linkage","sandbox-containment","generated-dom-runtime","artifact-bindings","isolation-receipts"],"inputDigest":"sha256:5c74bd50fe7bb5380ed64e3f5a74852cb9ffe7cfa6b4bbf9c6f0ba7d960d239f","artifactValidation":{"schemaVersion":1,"validator":"gatereeve/generated-html-dom-v1","engine":"linkedom-vm","result":"PASS","htmlDigest":"sha256:0b67824958d55648b60663c8bc859670011c28522db42c58a9dab7d561d2b000","checks":["parsed-document","self-contained-resources","inline-script-runtime","native-reveal-controls","visual-accessibility","finding-links"],"errors":[]},"errors":[]},"files":{"html":{"path":"whiteboard-defense.html","sha256":"sha256:0b67824958d55648b60663c8bc859670011c28522db42c58a9dab7d561d2b000"},"challenger":{"path":"challenger.json","sha256":"sha256:2165968fe18670e4f2c2b649e98611df10ce9444b0e0fb862bfbd9b022a7141f"},"defender":{"path":"defender-publisher.json","sha256":"sha256:e8ab5e3b8b93294db7884d24e22d80699824b2b73240ec973f3ff27597c14c51"}},"receipts":[{"stage":"challenger","path":"challenger-receipt.json","sha256":"sha256:30c761dec66adf4d2943a58548abc7bfd53eee265717cb47fb951d4b58ef8483"},{"stage":"defender-publisher","path":"defender-publisher-receipt.json","sha256":"sha256:26658a0dfee7cd8a6686b044cc319fb1855e06f8a3ff3f9b66645b539abc417b"}]}
