{"schemaVersion":1,"kind":"whiteboard-defense","module":{"id":"whiteboard-test/defense","version":"1.0.0","digest":"sha256:ed7d86c6c7df6238aad12515443ded715395d53182a92a90ecdfeea1a5345e08"},"source":{"attemptId":"whiteboard-test-and-judge-isolation-pr67-attempt-15","scope":"FEATURE","baseSha":"10e54a08ddfa0815bb8d4d2ae393f7c0c7ae2602","headSha":"752ef94adb86b92ca07f35b7f7ea3c290010c14e","inputFingerprint":"sha256:5b968c110707aa7fea97b32260c21b8b6452b914d250edcd30e015018d8dafd3"},"outcome":"FAIL","summary":"The feature adds a digest-pinned Whiteboard Defense module, a reusable isolated staged-agent runtime, Desktop and CLI execution paths, and Judge v2 isolation. The defense is strongest around graph contracts, artifact validation, digest binding, and fail-closed runtime behavior. The main residual limits are semantic: validators can prove structure, bindings, controls, and line-range existence, but they do not prove provider internals or the explanatory quality of every claim.","substantive":false,"artifactDeficiencies":["Whiteboard Defense invalid: generated artifact validation is invalid or stale"],"validation":{"schemaVersion":1,"validator":"whiteboard-test/deterministic-v1","result":"FAIL","checks":["challenge-integrity","evidence-resolution","native-progressive-reveal","visual-linkage","sandbox-containment","generated-dom-runtime","artifact-bindings","isolation-receipts"],"inputDigest":"sha256:58a8cb9d91dd033c10697827e57c1376976d28441a82d88ee0ffa426366b9ade","artifactValidation":{"schemaVersion":1,"validator":"gatereeve/generated-html-dom-v1","engine":"linkedom-vm","result":"FAIL","htmlDigest":"sha256:76e61a6117113dd3fbfbb4d54c0f74c4929208e29e1871873fd8af59a307a1f1","checks":["parsed-document","self-contained-resources","inline-script-runtime","native-reveal-controls","visual-accessibility","finding-links"],"errors":["inline finding f-linkedom-gap omits its type or summary","Defense Findings link f-linkedom-gap omits its type or summary","inline finding f-waiver-truth omits its type or summary","Defense Findings link f-waiver-truth omits its type or summary"]},"errors":["Whiteboard Defense invalid: generated artifact validation is invalid or stale"]},"files":{"html":{"path":"whiteboard-defense.html","sha256":"sha256:76e61a6117113dd3fbfbb4d54c0f74c4929208e29e1871873fd8af59a307a1f1"},"challenger":{"path":"challenger.json","sha256":"sha256:644d5e9b7f8becd77171bf42198f48b839ec308c8f6fa977aa65847b1fd3172a"},"defender":{"path":"defender-publisher.json","sha256":"sha256:b5f673d56977463654e5afe27a79d33cdc0fed2c28350cd1bb7b4eafc7ccaeb1"}},"receipts":[{"stage":"challenger","path":"challenger-receipt.json","sha256":"sha256:dff6c1f8477dbe7d7149050401502a3f8d74d0b3529ab7cd59f17b964740c08e"},{"stage":"defender-publisher","path":"defender-publisher-receipt.json","sha256":"sha256:95fdb203603f59d33d92ef30c69d2e099ec18a9b3fd090839c8d95a70f436cf9"}]}
